post_id,title,score,num_comments,created_utc
17vq5lq,Just for fun: roast my work / play setup,257,71,1700041273.0
17v427x,OrgNote - mobile app inspired by org-roam and org-roam-ui (early beta),254,62,1699974057.0
171v6om,Showcase of my org-agenda /break-mode integrated into my system bar.,189,27,1696646263.0
188kpwp,"Emacs Advent Calendar 1: Stable releases of Consult, Corfu, Cape, Vertico and more",157,18,1701460266.0
17q2a6d,When keyboard macros do the work for ya,140,25,1699385452.0
16xzszb,EXWM is rewiring my brain and I love it,139,38,1696260885.0
18hfso2,Emacs' helm is maintained by one maintaner for 11 years long. His mistake to switch from Paetron made him to lose nearly all his contributors. Consider to donate again?,134,40,1702470768.0
17w0pvm,Needed this so bad,118,21,1700074396.0
17c48kx,dape.el: DAP client that does not rely on LSP-mode,107,32,1697781820.0
17wpdzf,I love emacs,105,63,1700148017.0
187hlt7,Finally getting somewhere,102,20,1701347989.0
185z1pf,Transient v0.5.0 released,103,39,1701186341.0
182ulo1,Emacs Swift module is wonderful for macOS native UX integrations,100,12,1700839746.0
17omdgm,Finally got emacs installed on my steamdeck,98,31,1699220131.0
17975mc,emacs + llm = 🔥,94,35,1697466199.0
17nl7cw,Shout out to the eat terminal emulator package,90,31,1699102940.0
